,Unnamed: 0,Player Name,Player ID,Home Runs,Player Quote,Batting Hand,College
214,214,George Bell,bellge02,265,"""Oh sure, George Bell can be a crab. The Toronto slugger, who is the driving force behind his team's push to the top of the American League East, has, on occasion, been a bat-thrower, a pitcher-kicker, an umpire-baiter, a fan- taunter and, perhaps to his ultimate detriment, a media-dodger. But it may come as a surprise to those who would put him in the antisocial league with, say, J.D. Salinger or Sean Penn, that he also harbors an almost schoolboyish lust for awards and trophies. Bell himself admits he didn't really start to take baseball all that seriously until, as a youngster growing up in the Dominican Republic, he began accumulating scrolls and trinkets and statuettes for his play. ''I like to win trophies,'' he says with disarming candor. And it may well be true that his periodic bouts of misanthropy are the result not so much of any ingrained ill will as they are a simple reaction to rejection. Consider that, despite some superlative seasons, Bell hasn't even won his own team's Player of the Year award yet. And he hadn't made the All- Star team until a Toronto media blitz pushed him past the likes of Bo Jackson (the football player!) in the voting for this year's American League team. No, whatever you may think of him, George Bell just hasn't gotten his due as a great player."" - Fimrite, Ron. Sports Writer. Sports Illustrated: TORONTO'S BIG BRASS BELL. 7 September 1987.",Right,None Attended
215,215,Matt Stairs,stairma01,265,"""Do you have a favorite quote from or about this particular Major League Baseball player that you would like to see here? If so, please send it to us, and we'll update this page immediately."" - Baseball Almanac",Left,None Attended
216,216,Bobby Thomson,thomsbo01,264,"""Bobby Thomson will always hold a special place in our game for hitting one of the signature home runs in baseball history.'The Shot Heard Round the World' will always remain a defining moment for our game, illustrating the timeless quality of the national pastime."" - Selig, Bud. Commissioner of Major League Baseball. Thomson, hit famous '51 playoff homer, dies. Schlegel, John. MLB Staff Writer. 17 August 2010.",Right,None Attended
217,217,Danny Tartabull,tartada01,262,"""Do you have a favorite quote from or about this particular Major League Baseball player that you would like to see here? If so, please send it to us, and we'll update this page immediately."" - Baseball Almanac",Right,None Attended
218,218,José Abreu,abreujo02,261,"""He's (José Abreu) a difference-maker. He's such a quality at-bat. His power is unbelievable. He can take so many different pitches and just take you yard. You obviously respect what he can do. He's changed the complexion of their lineup and allows some of their other players to do other things as well. When you have a guy like that in your lineup, anchoring it, in a way it's kind of like what we have in Detroit with Miggy anchoring our lineup. He's only getting better and unfortunately that's a detriment to us."" – Scherzer, Max. Miguel Cabrera: Jose Abreu’s start is ‘amazing. Hayes, Dan. White Sox Beat Reporter. 14 July 2014.",Right,None Attended
219,219,Eric Chavez,chaveer01,260,"""Eric Chavez, the five-tool third baseman with extraordinary skill and a low-key California personality who won six straight Gold Glove awards and became the only star of the famed Moneyball A's to sign a long-term deal to stay in Oakland, is retiring Wednesday after an exceptional 16-plus-year career. Chavez rode great natural ability that allowed him to post six 25-homer seasons before he was 28 and unusual dedication and work ethic that transformed him from an 'all hit' prodigy to become one of baseball's best third basemen. He would later reinvent himself as a student of hitting and became a high-percentage bench player. But while Chavez characteristically expressed no regret save for the one disappointment over never quite reaching the World Series with the overachieving A's teams or star-studded Yankees teams -- despite some very close calls -- his interesting, bifurcated career path may leave some one wondering what might have been if not for a string of mid-to- late-career injuries."" - Jon Heyman (CBS Sports, 07/30/2014, Eric Chavez, a star who stayed barely out of the limelight, retires, Source)",Left,None Attended
220,220,Derek Jeter,jeterde01,260,"""I'm not going to boast about being the shortstop on a team that has won three of the last four World Championships, but it does feel good. I'm not going to tell you that as a 26-year old multimillionaire who still has all of his hair all of his teeth, and can get dates I have a perfect life, but it's good. I'm not going to tell you that you should want to be like me, because everyone should want to be their own person, but I assure you that it's fun to be me. What I do want to tell you is that I'm proud of where I am and how I got to this stage in my life, and I think there's a way for everyone to benefit from all that I have experienced while making it my dream. I'm proud of the guidance my parents gave me in helping me determined the best ways to methodically move closer and close to my dream, and I'm proud of how I've worked to reach that dream and maintain it. For me, the dream of being a baseball player is a daily challenge — not only living that dream but ensuring it stays alive."" - Jeter, Derek. The Life You Imagine: Life Lessons for Achieving Your Dreams. Broadway Books. 5 June 2001. Page XIV. [Derek Jeter Quotes]",Right,None Attended
221,221,Javy Lopez,lopezja01,260,"""I still think Javy's underrated. He's the total package. You can count total package catchers on one hand. He's one of them. He's everything you want in a baseball catcher. He plays hard, gives you everything he's got. And he's tough."" - Former Braves Coach Ned Yost (Samantha Carr, National Baseball Hall of Fame, 12/13/2011, 'Sweet-Swinging Backstop', Source)",Right,None Attended
222,222,Tim Wallach,wallati01,260,"""I'm both surprised and honored to be selected to the Canadian Baseball Hall of Fame. What a great thrill to be going in with such integral parts of the Montreal Expos for such a long time, and to join many of my old teammates and manager, along with so many people that meant so much to Canadian baseball. This is a great honor for my family and myself."" - Wallach, Tim. Wallach heads to Canadian Baseball Hall of Fame. Gurnick, Ken. MLB Staff Writer.",Right,Cal State Fullerton
223,223,Chase Utley,utleych01,259,"""If some Phillies do lack big league industriousness... Utley is beyond reproach, conspicuous in his effort. The 27-year-old second baseman dives for all grounders in his zip code. He grinds out at bats and bursts out of the box as if someone had fired a starter's pistol, even when he's not trying to extend a hitting streak. Yankees third base coach and former Phillies manager Larry Bowa says, 'He plays every game like it's the seventh game of the World Series.'"" - Farber, Michael. Sportswriter. Sports Illustrated: Grime Pays. 14 August 2006. Page 44.",Left,"University of California, Los Angeles"
224,224,Aaron Judge,judgeaa01,257,"""Do you have a favorite quote from or about this particular Major League Baseball player that you would like to see here? If so, please send it to us, and we'll update this page immediately."" - Baseball Almanac",Right,"California State University, Fresno"
225,225,Ian Kinsler,kinslia01,257,"""It was awesome. It was seriously one of the coolest things I've seen. I felt like a little kid. I was jumping up and down, screaming at the top of my lungs. It had no effect on him (Ian Kinsler) running the bases, but I felt like I was a part of it. It's one of those things you don't see very often. To hit the cycle and go 6-for-6. Six hits is a good week for some guys. At the same time, I'm not surprised because Kins is one of the best hitters I've seen. That's unbelievable."" - Teammate Chris Davis in The Dallas Morning News (Richard Durrett, 04/16/2009)",Right,Arizona State University & University of Missouri
226,226,Bob Allison,allisbo01,256,"""Anyone can be successful at baseball if he follows in the path of Bob Allison. All you have to do is be 6'4, strong as a weightlifter, handsome as a shirt model, have the personality of an honor graduate from Dale Carnegie, and, alas, work your head off."" - Sportswriter Leonard Schecter in Sports Magazine (September 1964), quoted from The New Bill James Historical Baseball Abstract (Bill James, 'Best Right Fielders in History: 56. Bob Allison', Page 825)",Right,University of Kansas
227,227,Larry Parrish,parrila01,256,"""No youngster in the organization has worked harder to polish his skills than (Larry) Parrish. He showed great poise in his exposure to the National League last fall and he a solid hitting approach."" - Manager Gene Mauch in ""Baseball Digest's 1975 Rookie All-Star Team"" (Baseball Digest : November 1975)",Right,None Attended
228,228,Vada Pinson,pinsova01,256,"""I'm going to get myself a corked bat and blast one out of here! What's the suspension for Old-Timers games, ten years?"" - Pinson, Vada. Baseball's Greatest Quotations. Dickson, Paul. Author. Collins Reference. 19 February 2008. Page 427.",Left,None Attended
229,229,Kirk Gibson,gibsoki01,255,"""When he (Kirk Gibson) hit that ball (during 1988 World Series), it was almost surreal. As devastating a blow as it was, I remember running off the field and saying, 'Man, that was unbelievable.' "" - Weiss, Walt. The Sporting News 25 Greatest Moments. 2001.",Left,Michigan State University
230,230,Adam LaRoche,larocad01,255,"""Twenty years from now when you're trying to impress your friends at some sort of social gathering, you can remind them how much of a baseball geek you are with this tidbit of knowledge: Pittsburgh Pirates first baseman Adam LaRoche became the first player to have a home run taken away via instant replay during a game against the St. Louis Cardinals on Wednesday. Umpires initially ruled the first inning hit a home run, but it appeared to hit a railing in center field and the ruling was reversed upon review."" - Los Angeles Times Staff Writer Austin Knoblauch (05/13/2009, Pirates' Adam LaRoche hits one for the history books, Source)",Left,Seminole State College
231,231,John Mayberry,maybejo01,255,"""I couldn't believe they (Kansas City) let him (John Mayberry) get away. He's awesome. He's the kind of guy that puts a little fright in you. They didn't have that big thumper in their lineup without him."" - New York Yankees Pitcher Rich ""Goose"" Gossage in Baseball Digest (March 1979)",Left,None Attended
232,232,John Olerud,olerujo01,255,"""Do you have a favorite quote from or about this particular Major League Baseball player that you would like to see here? If so, please send it to us, and we'll update this page immediately."" - Baseball Almanac",Left,Washington State University
233,233,Mookie Betts,bettsmo01,253,"""Do you have a favorite quote from or about this particular Major League Baseball player that you would like to see here? If so, please send it to us, and we'll update this page immediately."" - Baseball Almanac",Right,None Attended
234,234,Larry Doby,dobyla01,253,"""Lawrence, you are going to be part of history,"" Indians' owner Bill Veeck. ""Part of history? I have no notions about that. I just want to play baseball."" - Doby, Larry. Greatness in the Shadows: Larry Doby and the Integration of the American League. University of Nebraska Press. The Shadow Cast by Rickey and Robinson. 1 April 2016.",Left,None Attended
235,235,Joe Gordon,gordojo01,253,"""He (Joe) was one of the greats of the game—a truly brilliant defensive player. To me, he was the perfect second baseman with his ability to turn the double play and hit for power in such a difficult hitter's park as Yankee Stadium. He made Phil Rizzuto and Lou Boudreau better. He wasn't just good, he was great.""",Right,University of Oregon
236,236,Andre Thornton,thornan01,253,"""(Andre) Thornton's proved he can play first base exceptionally well defensively and the consistency of his hitting has been impressive."" - Chicago Cubs Manager Jim Marshall in Baseball Digest (November 1974)",Right,None Attended
237,237,Todd Zeile,zeileto01,253,"""Do you have a favorite quote from or about this particular Major League Baseball player that you would like to see here? If so, please send it to us, and we'll update this page immediately."" - Baseball Almanac",Right,"University of California, Los Angeles"
238,238,Bret Boone,boonebr01,252,"""On the last day of the 1998 season, the Reds helped Bret Boone make baseball trivia history by starting the only infield ever composed of two sets of brothers (Box Score): first baseman Stephen Larkin, second baseman Bret Boone, future Hall of Fame shortstop Barry Larkin, and their baseman Aaron Boone. During a 1991 interview, Ray Boone said: 'Bret came out of the womb hitting. He lived with us when Bob was doing his six months military service. Bret was barely two years old, but ever day I'd be out there in the backyard throwing Wiffle balls him. Bret crushed so many balls over the house that I called [former manager] Dave Garcia and told him to come watch the kid. Dave took one look at his swing and offered to sign him.'"" - Brodley, Hal. Author. How Baseball Explains America. Triumph Books. 1 May 2015. Page 85.",Right,University of Southern California
239,239,Bobby Murcer,murcebo01,252,"""You decide you'll wait for your pitch. Then, as the ball starts toward the plate, you think about your stance; and then you think about your swing; and then you realize that the ball that went past you for a strike was your pitch."" - Bobby Murcer in Men at Work: The Craft of Baseball (George Will, Harper Paperbacks, 04/24/1991, Page 217-218)",Left,None Attended
240,240,Joe Torre,torrejo01,252,"""When we lost, I couldn't sleep at night. When we win, I can't sleep at night. But when you win, you wake up feeling better."" - Torre, Joe. Coachisms: Winning Words from the Country's Finest Coaches. Howe, Ranyd. Author. The Lyons Press. 1 November 2005. Page 112.",Right,None Attended
241,241,Tony Armas,armasto01,251,"""TONY ARMAS WAS one of the more unusual players from the Red Sox during the 1980s. He could do two things - hit home runs and throw well. As a batter, his home runs represented his total contribution. His batting average was never very high and frequently was quite low. He struck out a lot and almost never walked. As a result, his on base average is among the lowest in major-league history. Bucky Dent, Leo Durocher, and Mark Belanger, all notoriously weak-hitting middle infielders, had higher on base averages than Tony Armas. As an outfielder, he had good instincts, but very little speed. As a special add-on bonus, he tended to suffer nagging little injuries on a regular basis."" - Author Bill Lewers in Six Decades of Baseball: A Personal Narrative (Xlibris Publishing, 11/06/2009, Page 225)",Right,None Attended
242,242,Tony Clark,clarkto02,251,"""That one (a 450-foot home run that hit the 2004 All-Star game sign between the light poles in Houston) might have left Yellowstone. There's not a ballpark in America that would have held that one."" - Manager Art Howe (08-05-2003)",Both,Arizona (DNP) & San Diego State (DNP)
243,243,Cy Williams,willicy01,251,"""Do you have a favorite quote from or about this particular Major League Baseball player that you would like to see here? If so, please send it to us, and we'll update this page immediately."" - Baseball Almanac",Left,University of Notre Dame
244,244,Robin Yount,yountro01,251,"""Robin Yount has an adventure-serial name and choir-boy looks and may well be the finest motorcycle-racing, golf-playing baseball player ever to emerge from the playgrounds of Woodland Hills, California. He comes across as the classic hero of Ralph Henry Barbour fiction: the lean, humble, gracefully athletic Superkid who leaped from prep school to the major leagues in a single bound."" - Prugh, Jeff. Los Angeles Times Sportswriter. Baseball Digest. November 1974.",Right,None Attended
245,245,Jose Valentin,valenjo03,249,"""Do you have a favorite quote from or about this particular Major League Baseball player that you would like to see here? If so, please send it to us, and we'll update this page immediately."" - Baseball Almanac",Both,None Attended
246,246,Goose Goslin,gosligo01,248,"""It was just a game, that's all it was. They didn't have to pay me. I'd have paid them to let me play. Listen, the truth is it was more than fun. It was heaven."" - Goslin, Goose. The Glory of Their Times. Ritter, Lawrence S. Author. Harper Press. 9 April 2010. Page 251.",Left,None Attended
247,247,Ted Simmons,simmote01,248,"""The ball jumps off the bat and you're running to first, drifting outside the line to start you on your way to second. The ultimate pleasure in baseball is that abstract moment when everything comes together and flows naturally."" - Ted Simmons",Both,None Attended
248,248,Justin Morneau,morneju01,247,"""You take positive steps every day. Obviously, it's always going to be there. You never know what's going to happen tomorrow or a week from now or a month from now, so it's the old cliché, take it one day at a time. That's really what I'm doing. As I build confidence every day and everything's going good, hopefully that stuff will be in the past by the time the season starts."" - Morneau, Justin. Morneau encouraged, feels no symptoms. Bollinger, Rhett. MLB Staff Writer. 29 February 2012.",Left,None Attended
249,249,Vern Stephens,stephve01,247,"""(Vern) Stephens and (Phil) Rizzuto are similar in value, but very different in type - a speedster against a slugger, a defensive play against a hitter, a leadoff man against a cleanup hitter, a player who played in a pitcher's park against a player who plays in a hitter's park, a player who had a good break on playing time against a player who missed three of his best seasons. When you try to balance them against one another, you can't be sure that you have it right unless you can be sure that you're placing exactly the right weight on each element."" - James, Bill. Author. The New Bill James Historical Abstract. Free Press Publishing. 13 June 2003. #22 Greatest Second Shortstop. Page 608.",Right,None Attended
250,250,Victor Martinez,martivi01,246,"""It made all the sense in young Victor Martinez's world to call his mother and tell her he was coming home after learning the Indians wanted him to switch positions from shortstop to catcher. Instead, Margot Coromoto Martinez calmed down her sobbing son and politely told him, 'Just try it first'. 'I'd been a shortstop since I was 7', Martinez said. These days, Martinez has his mother to thank for being one of the best young catchers in the major leagues."" - Sportswriter Stephanie Storm in the Akron Beacon Journal (01/28/2005)",Both,None Attended
251,251,Salvador Perez,perezsa02,246,"""It took about two days for me to realize he was special. I've been in this game a long time. I've been at the big league level a long time and see hundreds of catchers come through. And I've never seen one like him. He's a very rare find."" - Yost, Ned. Kansas City Royals Manager. Royals lock up Perez for five years. Kaegel, Dick. MLB Staff Writer. 27 February 2012.",Right,None Attended
252,252,Kyle Schwarber,schwaky01,246,"""People have no idea how hard it is to do what (Kyle Schwarber) just did. Only someone who is a freak of nature could do this. He's a natural born hitter. This is the stuff of legends as the World Series goes on."" - Chicago Cubs first baseman Anthony Rizzo (Verducci, Tom. Sports Illustrated: The inside story of how Cubs' Kyle Schwarber returned in time for World Series. 27 October 2016.)",Left,Indiana University
253,253,Ken Singleton,singlke01,246,"""When baseball ability was handed out, Ken Singleton received just about every advantage a major-leaguer could want. The 30-year-old Oriole was blessed with a strong arm, a sure glove and a productive, sometimes powerful bat from both sides of the plate. He also was given a pleasing face, an imposing 6'4"", 213-pound body and an imperturbable disposition. Unfortunately, he was granted the speed of a turtle."" - Keith, Larry. Sports Illustrated Writer. Beat Feet But Eyes Right. 25 July 1977. Page 38.",Both,Hofstra University
254,254,Eugenio Suárez,suareeu01,246,"""Do you have a favorite quote from or about this particular Major League Baseball player that you would like to see here? If so, please send it to us, and we'll update this page immediately."" - Baseball Almanac",Right,None Attended
255,255,Deron Johnson,johnsde01,245,"""He (Deron Johnson) means a lot,"" Larry Bowa said. ""He's what you call an established player. You can say, 'Greg (Luzinski) will hit 25 home runs,' but you don't KNOW what he'll do. He isn't established yet. And you can't say Willie (Montanez) is established. But this guy, you can look back over the years, when he's healthy. You know what he'll do."" He'll hit home runs. Probably 30 of them. He'll drive in runs. Maybe 100. And, just as important, he'll help the ball club by taking the pressure off the kids; by giving them advice. ""He's helped so much,"" Luzinski said. ""When he's playing they pitch him a certain way... and they usually pitch me the same way. We'll talk on the bend. He tells me what to expect... in his quiet way, Johnson helps a lot of people."" - Dolson, Frank. Philadelphia Inquirer Staff Writer. Leader Confined to the Clubhouse. 2 June 1972. Page 21.",Right,None Attended
256,256,Nick Swisher,swishni01,245,"""After the birth of my second child, I've decided to take a step back and spend the rest of this season full time with my wife and two daughters. Make no mistake, I am not hanging it up. I love this game with the same amount of passion that I had as a rookie 12 years ago."" - Swisher, Nick. Swisher opts out of Minor League deal with Yankees. Hoch, Bryan. MLB Staff Writer. 2 July 2016.",Both,Ohio State University
257,257,Mickey Tettleton,tettlmi01,245,"""There have been players who hold their bats precariously horizontal. There have been players who stood straight up. There have been players who unbuttoned their jerseys one button too many like a guest star on Miami Vice. There have been players with an inordinate amount of chaw in their mouths. There have been players who featured an all-business steely glare at the pitcher. There have even been players who appeared to be able to bench-press 400 points. There is only one player who put all that together and formed a company called Micky Tettleon. That company was about one thing: cool. Badass cool. You are toast cool. Check me out cool. I'm tougher than you cool."" - Ryness, Gar. Author. .Batting Stance Guy: A Love Letter to Baseball. Scribner Publishing. 11 May 2010. Page 65.",Both,Oklahoma State University
258,258,Hunter Pence,pencehu01,244,"""He kind of brought the fight back in everybody. Hunter's a pretty easy guy to get on board with when he gets fiery and gets those wide eyes. Without Hunter Pence stepping in and earning the nickname 'The Reverend' that season, I don't know that we have that 2012 ring on our fingers. Before every game we would huddle in the dugout and Hunter would be in the middle, firing us up. We'd throw the sunflower seeds and the gum and everybody would focus on the task at hand — which, obviously, was playing solid baseball. But I think we were able to keep everything in perspective, where the only thing that was important was the next pitch or the next at-bat or the next inning. We kept it very focused on the singular rather than on the big picture."" - George Kontos (Haft, Chris. MLB: Giants won't forget 'super motivator' Pence. 27 September 2020.)",Right,University of Texas at Arlington
259,259,Lou Whitaker,whitalo01,244,"""His career numbers look attractive by second-base standards. But it's hard to remember any period when (Lou) Whitaker was looked upon as the greatest second baseman of his era. 'Just' a very good player. There's no shame in that."" - Stark, Jayson. ESPN Analyst. My Hall of Fame Ballot. 19 November 2003. [Lou Whitaker Quotes]",Left,None Attended
260,260,Hack Wilson,wilsoha01,244,"""Hack Wilson usually played in the outfield, but I'd put him at first base because he wouldn't have as far to stagger to the dugout."" - Mike Royko in The Chicago Sun Times (1981)",Right,None Attended
261,261,Dusty Baker,bakerdu01,242,"""I believe in movement. You cannot do anything from dead standstill. All good hitters I've seen move. You have to have rhythm."" - Dusty Baker in Baseball Digest (June 1985, They Said It..., Page 6)",Right,American River Junior College
262,262,Sal Bando,bandosa01,242,"""Third baseman Sal Bando captained the feisty Oakland Athletics during their dynasty of the early 1970s, providing his share of punch and leadership to an exciting and talented ballclub. Although he retired third in career home runs by an American League third baseman - 242, behind only Graig Nettles and Brooks Robinson - his strongest point was neither his hitting not his fielding, but his drive to succeed."" - Silverman, Matthew. Baseball: The Biographical Encyclopedia. Total Sports Publishing. May 2000. Sal Bando Page 52.",Right,Arizona State University
